section_id,heading,text
section-0,FICHA TÉCNICA,"Ruta a las Tinas de la vall del Flequer Descubrimos una pequeña muestra del conjunto de tinas de vino del Bages, un legado muy singular que testimonia el pasado vinícola de muchos valles del Parque Natural de Sant Llorenç del Munt i l’Obac. Sant Llorenç del Munt i l'Obac - El Cairat, Bages, Barcelona, Cataluña Dificultad Baja Tiempo total efectivo 2:00 h Distancia total 6 km Desnivel acumulado +130 m / -130 m Altitud mínima 265 m Altitud máxima 345 m Punto de salida / llegada Aparcamiento de ca n’Oristrell Población más cercana Pont de Vilomara Altitud (m) Distancia (km) 2 – Tinas del Bleda 1 - Aparcamiento de Ca n’Oristrell Croquis de ruta derivado de un recorte de la base cartográfica de Catalunya propiedad del Institut Cartogràfic i Geològic de Catalunya (ICGC), utilizada bajo una licencia CC BY 4.0. en la ficha web de la ruta Descárgate el TRACK GPS 3 – Tinas del Tosques 4 – Tinas de l’Escudelleta 5 – Tinas del Ricardo"
section-1,LO MEJOR DE ESTA RUTA,"Descubrir un patrimonio vinícola único, declarado Bien Cultural de Interés Nacional Caminar por antiguos bancales de viñedos ahora reconquistados por el pino carrasco. Conocer un sector del Parque Natural de Sant Llorenç del Munt i l’Obac."
section-2,INTRODUCCIÓN,"Ruta semicircular de casi 6 km de longitud y unos 130 m de desnivel positivo acumulado que comienza en el aparcamiento de Ca n'Oristrell y resigue una parte del valle del torrente del Flequer. El itinerario, que transcurre por el sector noroccidental del Parque Natural de Sant Llorenç del Munt i l’Obac, nos muestra un maravilloso conjunto de elementos patrimoniales históricos: muros de piedra seca, bancales, barracas y tinas de vino. Concretamente, la ruta nos descubre, en su primera mitad, que hacemos por un bonito sendero, cuatro conjuntos de tinas: las tinas del Bleda, las tinas del Tosques, las tinas de la Escudelleta y las tinas del Ricardo. En la segunda mitad de la ruta, regresamos al punto de inicio a través de una cómoda pista que recorre la derecha orográfica del torrente del Flequer. El Parque Natural de Sant Llorenç del Munt i l’Obac destaca por sus montañas de conglomerado, pero también esconde, en el fondo de sus valles, tesoros que nos cuentan parte de nuestra historia reciente, cuando comarcas como el Bages eran grandes productoras de vino y sus habitantes moldeaban el paisaje para extraer el máximo provecho (entre los años 1860 y 1890 el Bages fue la comarca con más viñedo de Cataluña -hasta 27.700 hectáreas-). El abandono de los campos ha hecho que el bosque haya escondido y resguardado este patrimonio, permitiéndonos recuperarlo y disfrutarlo en la actualidad. La ruta que proponemos nos descubre estos elementos que hay que conservar y que para muchos es bastante desconocido. Las tinas más destacadas son las de la Escudellera y las de Ricardo, aunque las de las Tosques y las de la Bleda también son interesantes de visitar. Todas las tinas han sido recuperadas y restauradas y se encuentran en buen estado de conservación. Las tinas fueron construidas a pie de donde antes estaban los viñedos y se utilizaban para producir el vino allí mismo. Esto permitía realizar la vendimia más rápido y no tener que invertir tiempo y recursos en el transporte de la uva. Las tinas de la Escudellera y del Ricardo forman parte del Inventario del Patrimonio Arquitectónico de Cataluña. AVISO En verano de 2022 la zona por la que transcurre la ruta sufrió un importante incendio que calcinó todo el entorno. Sin embargo, la ruta se puede realizar con toda normalidad y las tinas y los senderos están en buen estado."
section-3,MÁS INFORMACIÓN,Tiempo total efectivo (sin paradas): 2:00 h. en total. 0:25 h desde el aparcamiento de Ca n'Oristrell hasta las tinas del Bleda; 0:05 h desde este punto hasta las tinas del Tosques; 0:20 h adicionales hasta las tinas de la Escudelleta; 0:15 h desde este lugar hasta las tinas del Ricardo y 0:55 h para regresar al aparcamiento. Dificultad: Baja. Ruta ideal para realizar con los más pequeños de la familia. Época: Todo el año. Aunque en pleno verano es una zona bastante calurosa y la segunda parte de la ruta se hace por una pista muy soleada sin demasiadas sombras. Observaciones: El itinerario está señalizado y durante todo el recorrido vamos encontrando paneles informativos sobre las tinas.
section-4,RECORRIDO,"Empezamos la ruta en el  aparcamiento de Ca n'Oristrell (0:00 h - 265 m), situado dentro del término municipal del Pont de Vilomara i Rocafort y donde encontramos un panel informativo del Parque Natural de Sant Llorenç del Munt i l’Obac. La mayor parte de la ruta transcurre dentro de ese espacio natural protegido. El sector noroccidental del Parque Natural de Sant Llorenç del Munt i l’Obac está conformado por un territorio montañoso dominado por los bancales, los muros y las construcciones de piedra seca, declaradas patrimonio de la humanidad en 2018. El abandono de los oficios del campo ha hecho que parte del territorio haya quedado cubierto por el bosque, principalmente de pino carrasco. Los incendios que se han ido sucediendo de vez en cuando han vuelto a dejar al descubierto ese patrimonio que no sólo resiste el paso del tiempo sino también las altas temperaturas del fuego. Salimos del aparcamiento y caminamos en subida por una pista de cemento, que dejamos después de dos curvas tomando una pista de tierra que sale hacia nuestra derecha. Al cabo de unos 200 m llegamos a otro desvío, nosotros tomamos la pista que sale a la derecha. Este primer tramo del itinerario se hace de manera muy cómoda por un camino ancho señalizado como sendero SL-C52, un itinerario local que remonta todo el valle del Flequer hasta el núcleo de Rocafort. Nosotros seguiremos sólo el primer tramo de este itinerario, visitando la zona con la mayor concentración de tinas de vino de la comarca. Después de unos 800 m llegamos a una nueva bifurcación, descartamos la pista de la izquierda (que es por la que después regresaremos) y tomamos en clara bajada la pista de la derecha. Rápidamente llegamos a una curva desde donde podemos acceder a las  tinas del Bleda (0:25 h - 295 m), conjunto formado por dos tinas y sus barracas correspondientes. Las tinas son construcciones hechas con piedra seca y mortero de cal, forradas con piezas de cerámica cocida y barnizadas para formar un contenedor capaz de almacenar el jugo de la uva. Las más antiguas son redondas, como las que vemos aquí, y las más modernas tienen planta rectangular. Retomamos nuestro recorrido por la pista por donde veníamos y bajamos hasta cruzar al otro lado del torrente del Flequer. Pocos maestros más adelante, nace un camino a la izquierda que nos permite acceder a las  tinas del Tosques (0:30 h - 290 m), donde podemos observar cuatro tinas de planta circular, cada una con su barraca adosada. Recuperamos la pista principal y continuamos por el itinerario marcado, ahora ganando un poco de altura y resiguiendo el contorno del torrente del Flequer en dirección E. La pista da paso a un agradable sendero estrecho y sombrío que avanza por el interior de un bonito pinar. Después de este baño de bosque, llegamos al conjunto más espectacular, las  tinas de la Escudelleta (0:45 h - 320 m), que está formado por once tinas de planta circular (con una capacidad cercana a los 18.000 litros), siete barracas y una prensa de vino. El camino sigue descendiendo hasta que cruza el torrente del Flequer. Bordeando el torrente enlazamos con la pista por donde después haremos la vuelta hacia Ca n'Oristell (izquierda). Antes, seguimos unos 300 m hacia la derecha para descubrir las  tinas del Ricardo (0:55h - 338 m), las últimas que visitamos. Este conjunto está formado por seis tinas, dos barracas y una prensa. Desde este punto el sendero SL-C52 sigue remontando el valle varios kilómetros más. Nosotros, sin embargo, hacemos media vuelta y regresamos hacia el punto de inicio. Para regresar más directos, avanzaremos siempre por la cómoda pista que recorre el torrente del Flequer por su lado derecho orográfico. En todo este tramo, podremos observar los antiguos bancales que antiguamente habían estado llenos de cepas. Sin pérdida, llegamos nuevamente al  aparcamiento de Ca n'Oristrell (2:00 h - 265 m), donde damos por terminada esta ruta. . EL FUEGO DEL BAGES, UNA OPORTUNIDAD PARA EL FUTURO El incendio del verano de 2022 en el Pont de Vilomara quemó 1.700 hectáreas, 400 de las cuales dentro de los límites del Parque Natural de Sant Llorenç del Munt i l’Obac. Tras este incendio, aparece la oportunidad de debatir y repensar qué es lo que se quiere en este entorno. La nueva realidad de la zona plantea la oportunidad de recuperar el cultivo de la uva alrededor de las tinas, tal y como se había hecho hace 150 años. El fuego ha puesto sobre la mesa el futuro de la zona que, probablemente, quedará como un espacio abierto que actuará de cortafuegos. El otro aspecto positivo es que también se recuperarían especies propias de espacios abiertos como el conejo, la liebre o el águila perdicera. Fuente: Agència Catalana de Notícies (ACN) y Diputación de Barcelona ¿SABÍAS ... Hay más de un centenar de tinas catalogadas en diferentes estados de conservación repartidas por la comarca del Bages y sólo en este valle ya se pueden localizar una treintena? Las primeras datan de principios del siglo XVII y quedaron en desuso con la filoxera. Las tinas son una de las joyas del patrimonio etnológico de Cataluña y una muestra excepcional y única en el mundo."
section-5,CÓMO LLEGAR EN COCHE,"Accedemos al punto de inicio de la ruta desde el pueblo del Pont de Vilomara. En este núcleo de población tomamos la carretera BV-1224 en dirección a Rocafort y Mura. Dejamos atrás el polígono industrial El Pont y, justo antes de llegar al punto kilométrico 4 de la carretera, tomamos la pista asfaltada que sale a la derecha (cartel de madera “Oristrell”). Después de una curva llegamos al aparcamiento de Ca n'Oristrell. El aparcamiento tiene capacidad para unos 10 vehículos. Esta guía web y PDF gratuita ha sido publicada con el apoyo de la Diputació de Barcelona. Las rutas pueden variar mucho en función de la época del año, de la nieve y de las condiciones meteorológicas. La señalización (marcas, paneles, balizas) que podemos encontrar a lo largo de la ruta también puede variar con el tiempo. RUTES PIRINEUS no se responsabiliza de cualquier mal uso de sus guías y recomienda que cada uno sea responsable y prudente en la montaña. Igualmente, os invitamos a documentaros con libros y guías especializadas para complementar la información descrita. Todos los tiempos son efectivos y toman un carácter orientativo, no se han tenido en cuenta las paradas por pequeñas que sean. Para cualquier sugerencia, RUTES PIRINEUS os invita a enviar"
section-6,NO TE PIERDAS...,"Las “Rutas del Vino DO del Pla de Bages”, un amplio abanico de experiencias enoturísticas que nos permiten descubrir el Bages y su cultura vitivinícola, más allá de las visitas tradicionales a las bodegas de la zona. Guías Web y PDF gratuitas Ponemos a tu disposición guías web y PDF –rutas de senderismo y alta montaña que te puedes descargar gratuitamente-, ¡unos contenidos de calidad y fiables elaborados por profesionales de la montaña para que puedas descubrir el Pirineo a tu aire! Salidas y excursiones guiadas Disponemos de un calendario de salidas organizadas o podemos prepararte una propuesta personalizada. Crestas y ascensiones, parques naturales, travesías,... ¡Con Rutas Pirineos descubrirás todos los secretos del Pirineo de la mano de los mejores guías de montaña! Rutas autoguiadas Te proponemos varias travesías que podrás realizar a tu aire pero sin preocupaciones ni incertidumbres: te entregaremos un libro de ruta, gestionaremos la logística de alojamientos, enlaces, picnics o equipajes, y dispondrás de un teléfono de emergencias en todo momento. Establecimientos recomendados Os recomendamos los mejores establecimientos que hay cerca de las rutas de senderismo y alta montaña que os proponemos en la web. Hoteles, restaurantes, museos, artesanos, deportes de aventura,... todos revisados por nuestro equipo para que tu experiencia en los Pirineos sea inolvidable! ¡DESCUBRE TODO LO QUE TE OFRECEMOS!"
